text,label,clean_text,target,adj_text
Finnish Raute Precision has won large glass batch plant and mortar plant orders from Mexico and the US .,positive,finnish raute precision large glass batch plant mortar plant order mexico u,1,finnish large u
"Vaahto Pulp & Paper , of Finnish Vaahto Group , has been awarded an order to renovate Finnish-Swedish forest industry company Stora Enso 's paperboard machine at the Ingerois Board Mill in Finland .",positive,vaahto pulp paper finnish vaahto group awarded order renovate finnishswedish forest industry company stora enso paperboard machine ingerois board mill finland,1,finnish awarded finnishswedish stora enso finland
"Combining the two producers will create a strong EU-based fertilizer industry capable of meeting global competition , they added .",positive,combining two producer create strong eubased fertilizer industry capable meeting global competition added,1,combining strong eubased capable global added
"Finnish IT solutions provider Affecto Oyj said today that it has won a frame contract , valued at some EUR2m , to implement the next phase of its insurance application for South African Mutual & Federal Insurance Company Limited M&F .",positive,finnish solution provider affecto oyj said today frame contract valued eur implement next phase insurance application south african mutual federal insurance company limited f,1,finnish said valued eur implement next south african mutual federal limited
HELSINKI AFX - KCI Konecranes said it has won an order for four hot metal ladle cranes from Indian steel producer Bhushan Steel and Strips Ltd. .,positive,helsinki afx kci konecranes said order four hot metal ladle crane indian steel producer bhushan steel strip ltd,1,said hot ladle indian
HELSINKI AFX - Outokumpu said its technology unit has won a 28 mln eur contract from Bosnia-Herzegovina 's Aluminij dd Mostar to upgrade an anode plant .,positive,helsinki afx outokumpu said technology unit mln eur contract bosniaherzegovina aluminij dd mostar upgrade anode plant,1,said upgrade
"HK Ruokatalo now accounts for about 50 % of poultry sales in Finland , and profitability is at a good level .",positive,hk ruokatalo account poultry sale finland profitability good level,1,good
"However , the bottom-line result improved thanks to positive financial items .",positive,however bottomline result improved thanks positive financial item,1,bottomline improved positive financial
"Kesko Agro Lietuva , the agricultural machinery and grain trader and another member of the Kesko Group , boosted its sales by 42.9 percent to 13.4 million euros , VAT inclusive .",positive,kesko agro lietuva agricultural machinery grain trader another member kesko group boosted sale percent million euro vat inclusive,1,lietuva agricultural boosted inclusive
"Lee & Man Paper and Metso have a long and prosperous co-operation , a good example of which are the Changshu and Hongmei kraftliner machines delivered earlier .",positive,lee man paper metso long prosperous cooperation good example changshu hongmei kraftliner machine delivered earlier,1,lee prosperous good delivered
"London 's leading shares today jumped almost 100 points , or 1.7 % , as the market opened .",positive,london leading share today jumped almost point market opened,1,leading jumped opened
Metso said it has won an order worth around 40 mln eur to supply a kraftliner board machine to China 's Lee & Man Paper Co. .,positive,metso said order worth around mln eur supply kraftliner board machine china lee man paper co,1,said mln lee
"Mika Stahlberg , VP F-Secure Labs , said , `` We are excited and proud that F-Secure has been recognized by AV-Comparatives as the Product of the Year .",positive,mika stahlberg vp fsecure lab said excited proud fsecure recognized avcomparatives product year,1,said excited proud recognized
"The Ministry of Water in Tanzania has awarded Poyry a water and sanitation engineering assignment for the rehabilitation and extension of water supply and sanitation infrastructure in Bukoba and Musoma , situated at Lake Victoria in northern Tanzania .",positive,ministry water tanzania awarded poyry water sanitation engineering assignment rehabilitation extension water supply sanitation infrastructure bukoba musoma situated lake victoria northern tanzania,1,awarded poyry situated lake northern
The policy was also aimed at making the companies more profitable and competitive .,positive,policy also aimed making company profitable competitive,1,aimed making profitable competitive
"The three year turn-around program is expected to ensure Salomon 's future competitiveness , the company said .",positive,three year turnaround program expected ensure salomon future competitiveness company said,1,expected ensure salomon said
"We are very pleased with the fine co-operation between the two countries in recent times , he said .",positive,pleased fine cooperation two country recent time said,1,pleased fine recent said
"Finland 's leading metals group Outokumpu said its fourth-quarter net profit more than tripled on the back of strong global demand for stainless steel , soaring base metal prices and proceeds from the sale of its technology unit .",positive,finland leading metal group outokumpu said fourthquarter net profit tripled back strong global demand stainless steel soaring base metal price proceeds sale technology unit,1,leading said fourthquarter net tripled strong global soaring
"`` We are delighted to announce our support for Intel based handheld platforms , the capabilities of which have made our development easier and faster .",positive,delighted announce support intel based handheld platform capability made development easier faster,1,delighted based handheld made easier
"According to Bosse , the present cooperation is beneficial to all parties , however .",positive,according bosse present cooperation beneficial party however,1,according bosse present beneficial
`` We are proud to contribute to the creation of a world-class airport facility with KONE 's innovative People Flow TM solutions .,positive,proud contribute creation worldclass airport facility kone innovative people flow tm solution,1,proud innovative flow tm
"Efore 's presence here also opens up new and interesting development opportunities for our students , '' the dean of the Faculty of Electronics , Communications and Automation at TKK said .",positive,efore presence also open new interesting development opportunity student dean faculty electronics communication automation tkk said,1,open new interesting dean said
One of my colleagues summed up the E7 quite aptly when he remarked : `` Fantastic hardware .,positive,one colleague summed e quite aptly remarked fantastic hardware,1,summed e remarked fantastic
Swiss franc surged to record 1.42 euros after it reported sharpest gain in manufacturing in March .,positive,swiss franc surged record euro reported sharpest gain manufacturing march,1,swiss surged reported sharpest
"The CL51 is designed to measure cloud base height and vertical visibility in all weather conditions , which makes it an ideal instrument for meteorological applications that rely on reliable cloud height detection .",positive,cl designed measure cloud base height vertical visibility weather condition make ideal instrument meteorological application rely reliable cloud height detection,1,designed height vertical make ideal instrument meteorological reliable
- I am pleased that Bjorn Wahlroos has accepted the nomination .,positive,pleased bjorn wahlroos accepted nomination,1,pleased accepted
"`` QPR 8 integrated management system is the fastest , easiest and most efficient way for organizations all around the world to take control of their human-centric business processes .",positive,qpr integrated management system fastest easiest efficient way organization around world take control humancentric business process,1,integrated fastest easiest efficient take humancentric
"`` We are delighted to welcome Elisa to our Board of Directors , '' said Garry McGuire , CEO of RMG Networks .",positive,delighted welcome elisa board director said garry mcguire ceo rmg network,1,delighted said garry
The representative body of Swedish Meats approved an improved offer from Finnish HK Ruokatalo to acquire the company .,positive,representative body swedish meat approved improved offer finnish hk ruokatalo acquire company,1,representative swedish approved improved finnish acquire
After the renovation the biggest moulding line in the Orhangazi foundry is the most modern line in Europe .,positive,renovation biggest moulding line orhangazi foundry modern line europe,1,biggest moulding orhangazi foundry modern
"Finland 's Neste Oil has been awarded the Chemical Industry Federation of Finland 's Innovation Award for its NExBTL technology , which enables biodiesel to be produced from vegetable oil and animal fat .",positive,finland neste oil awarded chemical industry federation finland innovation award nexbtl technology enables biodiesel produced vegetable oil animal fat,1,awarded nexbtl biodiesel produced vegetable
Finnish electronics manufacturer PKC Group Oyj ( OMX Helsinki : PKC1V ) said on Wednesday ( 31 December ) that it has completed the acquisition of MAN Nutzfahrzeuge AG 's cable harness business from MAN Star Trucks & Buses Spolka zoo in Poland .,positive,finnish electronics manufacturer pkc group oyj omx helsinki pkc v said wednesday december completed acquisition man nutzfahrzeuge ag cable harness business man star truck bus spolka zoo poland,1,finnish oyj omx said wednesday completed ag
"Higher bit rates for outgoing traffic improves the end-user experience of mobile broadband services such as video conferencing , file sharing and sending e-mails with attachments .",positive,higher bit rate outgoing traffic improves enduser experience mobile broadband service video conferencing file sharing sending email attachment,1,higher outgoing improves enduser mobile conferencing sharing sending email
"I am looking forward to contribute to SRV 's success with my competence '' , says Taneli Hassinen .",positive,looking forward contribute srv success competence say taneli hassinen,1,looking contribute say taneli
"It combines a perfect price performance with sophisticated management facilities , the company said .",positive,combine perfect price performance sophisticated management facility company said,1,perfect sophisticated said
"It provides customers with industry-leading elevators , escalators and innovative solutions for maintenance and modernization .",positive,provides customer industryleading elevator escalator innovative solution maintenance modernization,1,provides industryleading innovative
"Kemira Coatings is the leading supplier of paints in Northern and Eastern Europe , providing consumers and professionals with branded products in approx .",positive,kemira coating leading supplier paint northern eastern europe providing consumer professional branded product approx,1,coating leading northern eastern providing branded
Poyry has a good track record of major transportation projects in Latin America .,positive,poyry good track record major transportation project latin america,1,good major
"The Basware Connectivity services allow companies to handle purchase to pay processes online and make their internal processes more efficient , '' said CEO Ilkka Sihvo , Basware Corporation .",positive,basware connectivity service allow company handle purchase pay process online make internal process efficient said ceo ilkka sihvo basware corporation,1,allow handle online make internal said ceo
"The iTunes-based material will be accessible on Windows-based or Macintosh computers and transferable to portable devices , including Apple 's iPods .",positive,itunesbased material accessible windowsbased macintosh computer transferable portable device including apple ipod,1,itunesbased accessible windowsbased macintosh transferable portable including
This bold spinning 360 red fabric design is set beautifully on Ercols Napoli sofa .,positive,bold spinning red fabric design set beautifully ercols napoli sofa,1,bold red fabric set ercols
TomTom has given assurances that it will continue to sell maps to competitors if it wins EU approval .,positive,tomtom given assurance continue sell map competitor win eu approval,1,given sell map win
"We are very excited working with Maxis on this first commercial deployment of ` Master of Maya ' , said Joe Doering , Head of the Asia South region at Nokia Siemens Networks .",positive,excited working maxi first commercial deployment master maya said joe doering head asia south region nokia siemens network,1,excited working commercial said doering south siemens
"`` It gives us a sense of pride and exposure , '' said Bruce Hansen , the SVH sales representative for Wolverine .",positive,give u sense pride exposure said bruce hansen svh sale representative wolverine,1,give u said svh
"`` Nokia 's Calling All Innovators Africa competition has been specifically launched to enable developers to create locally relevant , best-of-breed mobile applications . ''",positive,nokia calling innovator africa competition specifically launched enable developer create locally relevant bestofbreed mobile application,1,calling launched enable relevant mobile
"`` P&O Ferries now has a very efficient and powerful vessel for its Dover to Calais route , '' head of the shipbuilder 's Rauma yard , Timo Suistio , said .",positive,p ferry efficient powerful vessel dover calais route head shipbuilder rauma yard timo suistio said,1,efficient powerful calais said
"`` We are happy to be working with Rapala to encourage boaters and anglers to introduce newcomers to the sport , '' said RBFF President & CEO Frank Peterson .",positive,happy working rapala encourage boater angler introduce newcomer sport said rbff president ceo frank peterson,1,happy working said rbff frank
`` We are pleased to welcome Tapeks Noma into Cramo group .,positive,pleased welcome tapeks noma cramo group,1,pleased welcome
CDLI highlights the companies that provided the most comprehensive response to the Carbon Disclosure Project CDP information request .,positive,cdli highlight company provided comprehensive response carbon disclosure project cdp information request,1,highlight provided comprehensive
"Luxembourg-registered investment fund Amber Trust II has won the final approval of Lithuania 's Competition Council to acquire 29.6 percent of Sanitas , the country 's largest pharmaceutical producer .",positive,luxembourgregistered investment fund amber trust ii final approval lithuania competition council acquire percent sanitas country largest pharmaceutical producer,1,luxembourgregistered final acquire largest pharmaceutical
"The adapter , awarded with the `` Certified Integration for SAP - ; NetWeaver '' endorsement , integrates Basware s invoice automation and procurement solutions with more than 200 different ERP systems .",positive,adapter awarded certified integration sap netweaver endorsement integrates basware invoice automation procurement solution different erp system,1,awarded certified endorsement basware invoice procurement different
The Commission is to be applauded for applying a fact-based and data-driven approach and for providing clarity for future petitions .,positive,commission applauded applying factbased datadriven approach providing clarity future petition,1,applauded applying factbased datadriven providing future
"The company , which celebrates its fiftieth anniversary next year , has been exporting distinctive detached homes to Central Europe for several decades .",positive,company celebrates fiftieth anniversary next year exporting distinctive detached home central europe several decade,1,celebrates fiftieth anniversary next exporting distinctive detached central europe several
The energy-efficient data center will be built by combining an effective energy solution with state-of-the-art technology .,positive,energyefficient data center built combining effective energy solution stateoftheart technology,1,energyefficient built combining effective
The social plan negotiations were part of the three year turn-around program which is expected to ensure Salomon 's future competitiveness .,positive,social plan negotiation part three year turnaround program expected ensure salomon future competitiveness,1,social negotiation expected ensure salomon
"Nokia , which has a strong track record in the lower-end handset market , said in July its touch-screen offering would come this year and be cheaper than rival models in order to tap into a higher-volume market .",positive,nokia strong track record lowerend handset market said july touchscreen offering would come year cheaper rival model order tap highervolume market,1,strong said touchscreen offering would come cheaper tap
"We aim to ensure that Vacon is in good shape when capital expenditure starts to pick up again , '' comments Vacon Plc President and CEO Vesa Laisi .",positive,aim ensure vacon good shape capital expenditure start pick comment vacon plc president ceo vesa laisi,1,ensure good start pick
"Sales climbed 19.2 pct to 1.002 bln eur , surpassing the 953 mln eur consensus figure .",positive,sale climbed pct bln eur surpassing mln eur consensus figure,1,climbed pct surpassing mln eur
"Suominen Corporation estimates that the cost-cutting program that started in autumn 2005 , higher sales prices , and expected growth in volume of Wet Wipes , will make the company 's operations more profitable .",positive,suominen corporation estimate costcutting program started autumn higher sale price expected growth volume wet wipe make company operation profitable,1,suominen costcutting started higher expected wet make profitable
"In a release , the Company said that Vocollect T2 customers in North America can now take advantage of its Voice Directed Warehousing solution and increase warehouse efficiency and productivity gains at a discounted price .",positive,release company said vocollect customer north america take advantage voice directed warehousing solution increase warehouse efficiency productivity gain discounted price,1,said vocollect take directed warehousing discounted
Business boomed after Ostrom helped plant a small story about Rapala lures in a Life magazine issue that featured Marilyn Monroe on the cover .,positive,business boomed ostrom helped plant small story rapala lure life magazine issue featured marilyn monroe cover,1,boomed helped small featured marilyn
Finnish OKO bank has signed a cooperation agreement with Raiffeisen concerning Finnish companies ' investments in Russia .,positive,finnish oko bank signed cooperation agreement raiffeisen concerning finnish company investment russia,1,finnish oko signed concerning finnish
Paper maker Stora Enso Oyj said Friday it has been acquitted of charges that it participated in a paper price-fixing conspiracy in the United States .,positive,paper maker stora enso oyj said friday acquitted charge participated paper pricefixing conspiracy united state,1,stora enso said acquitted participated pricefixing united
"Cooper SH , the UK distributor for lift equipment manufacturer Konecranes , won the five-year deal which involves low maintenance and fuel saving technologies .",positive,cooper sh uk distributor lift equipment manufacturer konecranes fiveyear deal involves low maintenance fuel saving technology,1,uk fiveyear deal low saving
Metsaliitto said that it will book a minor gain of less than EUR1 .0 m from the transaction .,positive,metsaliitto said book minor gain le eur transaction,1,said minor le eur
"The negotiations were carried out in a constructive manner , and all parties tried to find a solution to the situation .",positive,negotiation carried constructive manner party tried find solution situation,1,carried constructive tried find
This is a much better process than using virgin paper as it requires less transportation of wood pulp from places like Finland and Canada .,positive,much better process using virgin paper requires le transportation wood pulp place like finland canada,1,much better using virgin requires le
"After the reporting period , BioTie North American licensing partner Somaxon Pharmaceuticals announced positive results with nalmefene in a pilot Phase 2 clinical trial for smoking cessation .",positive,reporting period biotie north american licensing partner somaxon pharmaceutical announced positive result nalmefene pilot phase clinical trial smoking cessation,1,reporting biotie north american somaxon announced positive clinical
"`` Indo-Russia trade can cross the targeted 10 billion dollars by 2010 and double to 20 billion dollars by 2015 , if trade irritants and procedural hassles are resolved , '' the chamber said in its survey on obstacles to trade with Russia .",positive,indorussia trade cross targeted billion dollar double billion dollar trade irritant procedural hassle resolved chamber said survey obstacle trade russia,1,targeted double irritant procedural resolved said
"`` This is a significant milestone for Benefon , helping us to secure critical USP 's for our personal navigation product roadmap for 2007 and beyond , '' commented Simon Button , Chief Technology Officer at Benefon .",positive,significant milestone benefon helping u secure critical usp personal navigation product roadmap beyond commented simon button chief technology officer benefon,1,significant helping u critical usp personal roadmap commented simon
"18 May 2010 - Finnish electronics producer Elcoteq SE HEL : ELQAV said today that it has signed an extensive cooperation agreement on industrialisation , manufacturing , distribution and after-market services for mobile phones with Japan 's Sharp TYO : 6753 .",positive,may finnish electronics producer elcoteq se hel elqav said today signed extensive cooperation agreement industrialisation manufacturing distribution aftermarket service mobile phone japan sharp tyo,1,may finnish elcoteq said signed extensive manufacturing sharp
"Investors will continue being interested in the company 's share although it is not quite cheap , Affarsvarlden said .",positive,investor continue interested company share although quite cheap affarsvarlden said,1,interested cheap said
"In complying with the European Water Framework Directive requirements , the pre-treatment unit will be fully renovated , including hydraulics of waste water inception , degridding , sand and grease removal and treatment and deodorization of the unit .",positive,complying european water framework directive requirement pretreatment unit fully renovated including hydraulics waste water inception degridding sand grease removal treatment deodorization unit,1,complying european directive renovated including degridding
"So far , Mr. Galvan he has been able to avoid laying off workers .",positive,far mr galvan able avoid laying worker,1,mr able laying
The StoneGate UTM solution offers protection against inbound and outbound attacks .,positive,stonegate utm solution offer protection inbound outbound attack,1,utm
The completion of the recycling plant is an important link in the chain of creating a waste management system in the Dubna region that meets the EU standards .,positive,completion recycling plant important link chain creating waste management system dubna region meet eu standard,1,recycling important creating dubna eu
"Upon completion , Keskuskatu will form the backbone of Helsinki 's pedestrianised downtown area , linking up with the city 's other main pedestrian precincts .",positive,upon completion keskuskatu form backbone helsinki pedestrianised downtown area linking city main pedestrian precinct,1,pedestrianised downtown linking main pedestrian
"Markets had been expecting a poor performance , and the company 's stock was up 6 percent at  x20ac 23.89 US$ 33.84 in early afternoon trading in Helsinki .",positive,market expecting poor performance company stock percent x ac u early afternoon trading helsinki,1,expecting poor early
The layoffs were aimed at reaching an annual savings target of 1.5 billion euros $ 2 billion by the end of 2010 .,positive,layoff aimed reaching annual saving target billion euro billion end,1,aimed reaching annual saving euro
"According to Finnish insurance companies Tapiola , Local Insurance Group ( L+Æhivakuutus ) , and Pohjola the two fierce storms at the end of July and in the beginning of August 2010 that felled trees around Finland have speeded up sales of forest insurance .",positive,according finnish insurance company tapiola local insurance group lhivakuutus pohjola two fierce storm end july beginning august felled tree around finland speeded sale forest insurance,1,according finnish tapiola local lhivakuutus fierce storm beginning felled speeded
"Excluding non-recurring items , pre-tax profit surged 45 % to EUR80m .",positive,excluding nonrecurring item pretax profit surged eur,1,excluding nonrecurring item pretax surged
"Talentum expects that the net sales of its core business will increase in 2008 , compared to 2007 .",positive,talentum expects net sale core business increase compared,1,expects net compared
"`` In the newly formed company YIT Stavo the local contact network , expertise and market know how of Euro Stavokonsult will be combined with YIT 's housing concept , '' said Juha Kostiainen , Yit 's Vice President , Corporate Communications and Business Development .",positive,newly formed company yit stavo local contact network expertise market know euro stavokonsult combined yit housing concept said juha kostiainen yit vice president corporate communication business development,1,formed stavo local know combined said juha yit corporate
A & euro ; 4.8 million investment in 13.6 % of Lewa netted Deutsche Beteiligungs & euro ; 21 million .,positive,euro million investment lewa netted deutsche beteiligungs euro million,1,netted
