text,label,clean_text,target,adj_text
"ADPnews - Jun 30 , 2009 - Finnish stainless steel maker Outokumpu Oyj HEL : OUT1V said yesterday it signed a three-year EUR 900 million USD 1.3 bn revolving credit facility .",positive,adpnews jun finnish stainless steel maker outokumpu oyj hel v said yesterday signed threeyear eur million usd bn revolving credit facility,1,jun finnish outokumpu oyj said signed threeyear usd revolving
Most of the increase in net sales was due to the acquisition of Swedish Silva that produces garden tools and boats .,positive,increase net sale due acquisition swedish silva produce garden tool boat,1,due swedish produce garden
SysOpen Digia had signed an agreement with the main shareholders of Sentera holding in total 77.39 % of the share capital and votes of Sentera .,positive,sysopen digia signed agreement main shareholder sentera holding total share capital vote sentera,1,sysopen signed main holding total
The company plans to expand into the international market through its subsidiaries and distributors from 2011 onwards .,positive,company plan expand international market subsidiary distributor onwards,1,expand international
"The decision to sell a share in Lenenergo was reached in line with Fortum 's strategic plans to invest mainly in generating assets in Russia , while Lenenergo is a grid company , the press release said .",positive,decision sell share lenenergo reached line fortum strategic plan invest mainly generating asset russia lenenergo grid company press release said,1,lenenergo reached strategic invest generating grid said
"The equipment will expand container handling capacity at Namibia 's main port of Walvis Bay , on the west coast .",positive,equipment expand container handling capacity namibia main port walvis bay west coast,1,handling main
The expansion includes the doubling of the floor space and the addition of more lifting capacity and production equipment .,positive,expansion includes doubling floor space addition lifting capacity production equipment,1,includes doubling lifting
The Group aims to increase its net sales and comparable operating profit in 2006 .,positive,group aim increase net sale comparable operating profit,1,aim increase net comparable
"The subscriptions increase Cargotec 's share capital by 36,780 euros .",positive,subscription increase cargotec share capital euro,1,
"The subscriptions increase Cargotec 's share capital by EUR 27,060 .",positive,subscription increase cargotec share capital eur,1,
"The total area of the Gorelovo plant is about 22,000 sq m. Atria invested about EURO 70mn in the plant , which should double Atria Russia 's production capacity in the St Petersburg area .",positive,total area gorelovo plant sq atrium invested euro mn plant double atrium russia production capacity st petersburg area,1,total invested euro double st petersburg
"With the launch of new 3G handsets , Nokia aims to become the winner in China 's 3G market as it did in the 2G market .",positive,launch new g handset nokia aim become winner china g market g market,1,launch new nokia winner china
"Earnings per share ( EPS ) for the first quarter 2007 amounted to EUR0 .07 , up from EUR0 .04 .",positive,earnings per share eps first quarter amounted eur eur,1,amounted eur
"Operating profit was EUR 11.07 mn , up from EUR 8.65 mn .",positive,operating profit eur mn eur mn,1,
"Significance : Teleste has emphasised that with its large size and growing economy , as well as the rapid development of its TV services distribution industry , Poland is viewed as an attractive market .",positive,significance teleste emphasised large size growing economy well rapid development tv service distribution industry poland viewed attractive market,1,emphasised large growing rapid viewed attractive
"`` We reached agreement with the union that flights will continue as normal , '' Finnair spokesman Usko Maatta said .",positive,reached agreement union flight continue normal finnair spokesman usko maatta said,1,reached continue normal usko said
"In Finland , insurance company Pohjola and the Finnish motorcyclist association have signed an agreement with the aim of improving motorcyclists ' traffic safety .",positive,finland insurance company pohjola finnish motorcyclist association signed agreement aim improving motorcyclist traffic safety,1,pohjola finnish signed improving
"HELSINKI ( AFX ) - Nokian Tyres reported a fourth quarter pretax profit of 61.5 mln eur , up from 48.6 mln on the back of strong sales .",positive,helsinki afx nokian tyre reported fourth quarter pretax profit mln eur mln back strong sale,1,nokian reported fourth pretax strong
"Kalnapilio-Tauro Grupe ( Kalnapilis-Tauras Group ) , which is owned by Denmark 's Royal Unibrew , raised its market share to 25.18 percent from 23.74 percent , as beer sales for the seven months jumped by 14.5 percent to 40.5 million liters .",positive,kalnapiliotauro grupe kalnapilistauras group owned denmark royal unibrew raised market share percent percent beer sale seven month jumped percent million liter,1,owned raised percent jumped
"Kalnapilio-Tauro Grupe ( Kalnapilis-Tauras Group ) , which is owned by Denmark 's Royal Unibrew , raised its market share to 25.2 percent from 23.91 percent , as beer sales for the nine months jumped by 11.4 percent to 52.99 million liters .",positive,kalnapiliotauro grupe kalnapilistauras group owned denmark royal unibrew raised market share percent percent beer sale nine month jumped percent million liter,1,owned raised percent jumped
"Marimekko has today ( 20 November ) signed a license agreement with the Swedish chain , whereby Marimekko will license some of its popular patterns from the 1950s , 1960s and 1970s to H&M .",positive,marimekko today november signed license agreement swedish chain whereby marimekko license popular pattern h,1,signed license swedish popular
More staff has been recruited in Japan to further complement its network of close to 50 service locations in more than 20 countries worldwide .,positive,staff recruited japan complement network close service location country worldwide,1,recruited close
Nokian Capacitors ' equipment will be used to raise the capacity and reliability of the Indian grid .,positive,nokian capacitor equipment used raise capacity reliability indian grid,1,nokian used indian
Rautaruukki Corporation Stock exchange release 3 December 2009 at 12 noon Ruukki 's construction and engineering divisions are to further improve and adjust their operations in Finland .,positive,rautaruukki corporation stock exchange release december noon ruukki construction engineering division improve adjust operation finland,1,improve
"Ruukki Romania , the local arm of Finnish metal producer Ruukki , increased its capital by 900,000 euro ( $ 1.14 mln ) through cash contribution , it was reported on September 19 , 2006 .",positive,ruukki romania local arm finnish metal producer ruukki increased capital euro mln cash contribution reported september,1,romania local finnish increased reported
"STX Finland Oy signed a a preliminary agreement for the building of an environmentally friendly , new generation cruise ferry for Viking Line to manage on between Turku , Finland , and Stockholm , Sweden withViking Line ABP .",positive,stx finland oy signed preliminary agreement building environmentally friendly new generation cruise ferry viking line manage turku finland stockholm sweden withviking line abp,1,signed preliminary building friendly new viking stockholm sweden
The company now estimates its net sales in 2010 to increase considerably from 2009 and its operating result to be clearly positive .,positive,company estimate net sale increase considerably operating result clearly positive,1,operating positive
"The tower it chose to add , due to go into operation in the summer , will increase total capacity to 80 broadsheet or 160 tabloid pages , with the ability to run 32 - and 48-page products side by side .",positive,tower chose add due go operation summer increase total capacity broadsheet tabloid page ability run page product side side,1,add due go total tabloid run side
"Uponor made an operating profit of EUR 151.0 mn , up from EUR 143.7 mn , which made 2007 a record year .",positive,uponor made operating profit eur mn eur mn made record year,1,uponor made made
"Basware Corporation stock exchange release August 31 , 2010 at 16:25 Basware signed a large deal with an international industrial group Basware will deliver Invoice Automation solution and Connectivity Services to an international industrial group .",positive,basware corporation stock exchange release august basware signed large deal international industrial group basware deliver invoice automation solution connectivity service international industrial group,1,signed large international industrial international industrial
It estimates the operating profit to further improve from the third quarter .,positive,estimate operating profit improve third quarter,1,improve third
Kazgiprotsvetmet and Outotec Finland have signed an agreement on strategic cooperation in the marketing and providing of minerals processing and metallurgical plants and related services in Kazakhstan and the surrounding countries .,positive,kazgiprotsvetmet outotec finland signed agreement strategic cooperation marketing providing mineral processing metallurgical plant related service kazakhstan surrounding country,1,kazgiprotsvetmet outotec signed strategic providing mineral processing metallurgical related surrounding
Lemcon signed an investment cooperation agreement with the Kaluga regional administration last November .,positive,lemcon signed investment cooperation agreement kaluga regional administration last november,1,signed kaluga regional last november
Ruukki forecast a 15-20 % annual sales growth and a positive pretax result for 2010 .,positive,ruukki forecast annual sale growth positive pretax result,1,annual positive
Sales rose 10 pct to 566 mln eur on the back of strong volume and favourable currency effects .,positive,sale rose pct mln eur back strong volume favourable currency effect,1,rose pct mln strong favourable
The growth of net sales has continued favourably in the Middle East and Africaand in Asia Pacific .,positive,growth net sale continued favourably middle east africaand asia pacific,1,net continued middle east
"The new agreement , which expands a long-established cooperation between the companies , involves the transfer of certain engineering and documentation functions from Larox to Etteplan .",positive,new agreement expands longestablished cooperation company involves transfer certain engineering documentation function larox etteplan,1,new expands longestablished involves transfer certain
With this appointment Kaupthing Bank aims to further co-ordinate Capital Markets activities within the Group and to improve the overall service to clients .,positive,appointment kaupthing bank aim coordinate capital market activity within group improve overall service client,1,kaupthing coordinate improve overall
"To prove the efficiency of the China Mobile system , Rod Baber , an English climber , climbed to the Mount Everest summit and successfully made calls .",positive,prove efficiency china mobile system rod baber english climber climbed mount everest summit successfully made call,1,prove mobile rod english climbed mount everest made
"Finnish Ahlstrom Corporation will double its investments in a new specialty glassfiber reinforcement plant in South Carolina , in the US .",positive,finnish ahlstrom corporation double investment new specialty glassfiber reinforcement plant south carolina u,1,finnish double new south u
Sales rose to 300.9 mln eur compared with last year 's 276.1 mln eur and in line with 299 mln eur consensus figure .,positive,sale rose mln eur compared last year mln eur line mln eur consensus figure,1,rose mln compared last mln eur
The contract was signed in August with Papua New Guinea-based Lihir Gold Ltd ASX : LGL .,positive,contract signed august papua new guineabased lihir gold ltd asx lgl,1,signed papua new guineabased lihir
"`` Our extensive co-operation will also bolster SysOpen Digia 's position in the domestic operator market , '' Kallioranta adds .",positive,extensive cooperation also bolster sysopen digia position domestic operator market kallioranta add,1,extensive sysopen digia domestic kallioranta add
"`` With this agreement , we can continue our good cooperationand at the same time release capital that has been tied up in ourmachinery operation .",positive,agreement continue good cooperationand time release capital tied ourmachinery operation,1,continue good tied
"Theodosopoulos said Tellabs could be of value to Nokia Siemens or Nortel given its `` leading supply status '' with Verizon , along with high-growth products .",positive,theodosopoulos said tellabs could value nokia siemens nortel given leading supply status verizon along highgrowth product,1,said could siemens given leading
"We succeeded in increasing our market share of sold apartment '' , comments Mr Kari Kauniskangas , Head of YIT International Construction Services .",positive,succeeded increasing market share sold apartment comment mr kari kauniskangas head yit international construction service,1,succeeded increasing sold apartment kauniskangas yit international
"With CapMan as a partner , we will be able to further develop our business and continue to focus on providing quality restaurant services for our customers , '' says Christopher Wynne , CEO of Papa John 's Russia .",positive,capman partner able develop business continue focus providing quality restaurant service customer say christopher wynne ceo papa john russia,1,able continue providing say
"Finnish Suominen Corporation that specialises in wet wipes , nonwovens , and flexible packaging reports net sales of EUR 44.1 mn in the second quarter of 2010 , up from EUR 43.3 mn in the second quarter of 2009 .",positive,finnish suominen corporation specialises wet wipe nonwovens flexible packaging report net sale eur mn second quarter eur mn second quarter,1,finnish specialises wet flexible packaging net mn second second
"Finnish telecoms software developer Tecnomen Oyj said on December 5 , 2006 it won a $ 3.3 mln ( 2.5 mln euro ) order to supply an expansion of the charging and messaging systems for the mobile and fixed networks of Brasil Telecom .",positive,finnish telecom software developer tecnomen oyj said december mln mln euro order supply expansion charging messaging system mobile fixed network brasil telecom,1,finnish said december euro charging messaging mobile fixed
Increased trust of our clients in YIT can be seen as apartment sales accelerated .,positive,increased trust client yit seen apartment sale accelerated,1,increased seen apartment accelerated
"( ADP News ) - Dec 11 , 2008 - Finnish construction and engineering company Outotec Oyj ( OMX : OTE1V ) said today it won a EUR 28 million ( USD 36.8 m ) order to expand the phosphate concentrator in Siilinjarvi of Norwegian minera",positive,adp news dec finnish construction engineering company outotec oyj omx ote v said today eur million usd order expand phosphate concentrator siilinjarvi norwegian minera,1,adp finnish outotec omx said usd norwegian
"Mr Priit Kasak , Balti Metsamasina 's owner , said the Rakvere-based company wishes to increase Valmet 's market share from 27 % to a third in a couple of years .",positive,mr priit kasak balti metsamasina owner said rakverebased company wish increase valmet market share third couple year,1,said rakverebased wish third
The bank sees a potential for Getinge share to rise .,positive,bank see potential getinge share rise,1,see potential
"The company recorded revenues of E658 .1 million during the fiscal year ended December 2007 , an increase of 23 % over 2006 .",positive,company recorded revenue e million fiscal year ended december increase,1,recorded fiscal ended
The cooperation will double The Switch 's converter capacity .,positive,cooperation double switch converter capacity,1,double
The robust growth was the result of the inclusion of clothing chain Lindex in the Group in December 2007 .,positive,robust growth result inclusion clothing chain lindex group december,1,robust
"The six breweries recorded a 5.2 percent growth in domestic beer sales last year to 270.21 million liters , from 256.88 million liters sold in 2005 .",positive,six brewery recorded percent growth domestic beer sale last year million liter million liter sold,1,recorded domestic last liter liter sold
"This truly takes efficiency to new heights , '' Mr. Metso adds .",positive,truly take efficiency new height mr metso add,1,take new
We hope to increase traffic volumes with the opening of Freight One Scandinavia . '',positive,hope increase traffic volume opening freight one scandinavia,1,opening freight
"a January 11 , 2010 EPHC board of directors has approved an increase in the quarterly dividend from $ 0.03 to $ 0.05 per share .",positive,january ephc board director approved increase quarterly dividend per share,1,january approved increase quarterly
"Finnish Cargotec 's Kalmar , the business area providing container handling solutions , has been awarded an order for a further ten E-One rubber-tyred gantry RTG cranes from Saigon Newport Company SNP , in Vietnam .",positive,finnish cargotec kalmar business area providing container handling solution awarded order ten eone rubbertyred gantry rtg crane saigon newport company snp vietnam,1,finnish providing handling awarded rubbertyred
"Bilfinger investors cheered the agreement , pushing shares up 7 % , or & euro ; 3.30 , to & euro ; 50.29 , in afternoon trade .",positive,bilfinger investor cheered agreement pushing share euro euro afternoon trade,1,cheered pushing
"Kesko pursues a strategy of healthy , focused growth concentrating on sales and services to consumer-customers .",positive,kesko pursues strategy healthy focused growth concentrating sale service consumercustomers,1,healthy focused concentrating
"LONDON AFX - Shares in Rautaruukki Corp have been upgraded to ` hold ' from ` sell ' by ABN Amro , with the price target raised to 25.75 eur from 14.5 , said dealers .",positive,london afx share rautaruukki corp upgraded hold sell abn amro price target raised eur said dealer,1,rautaruukki upgraded amro raised said
LONDON MarketWatch -- Nokia nok said it 's won a five-year services contract to run Hutchison Essar 's network operations in nine locations in India .,positive,london marketwatch nokia nok said fiveyear service contract run hutchison essar network operation nine location india,1,london said fiveyear run
"Progress Group , QPR 's representative in Saudi Arabia and North Africa , has signed a framework agreement for a long term strategic relationship with ISE .",positive,progress group qpr representative saudi arabia north africa signed framework agreement long term strategic relationship ise,1,qpr representative arabia north signed long strategic
"Ragutis , controlled by the Finnish brewery Olvi , achieved a 5.7 percent rise in beer sales to 22.6 million liters and held a 10.75 percent market share .",positive,ragutis controlled finnish brewery olvi achieved percent rise beer sale million liter held percent market share,1,controlled finnish achieved percent held
"The 250 sq m 2,691 sq ft store in Copenhagen 's premier shopping district was inaugurated today , further strengthening the company 's presence in Nordic capitals .",positive,sq sq ft store copenhagen premier shopping district inaugurated today strengthening company presence nordic capital,1,shopping inaugurated strengthening nordic
"The metal has gained 41 percent this year as demand from China , the world 's largest user , increased .",positive,metal gained percent year demand china world largest user increased,1,gained percent china largest increased
"In addition , Cramo and Peab have signed exclusive five-year rental agreements in Finland and have extended their existing rental agreements in the Swedish market for another five years .",positive,addition cramo peab signed exclusive fiveyear rental agreement finland extended existing rental agreement swedish market another five year,1,signed exclusive fiveyear rental extended existing rental swedish
"OUTOTEC OYJ PRESS RELEASE DECEMBER 4 , 2009 10.30 AM Outotec establishes a new subsidiary in Kolkata Outotec has established a subsidiary in India in order to better serve its Indian customers and to increase its business in the growing Indian market .",positive,outotec oyj press release december outotec establishes new subsidiary kolkata outotec established subsidiary india order better serve indian customer increase business growing indian market,1,outotec oyj establishes new outotec established indian growing indian
It is also 7.7 pct above the 12-month volume weighted average price of the stock .,positive,also pct month volume weighted average price stock,1,pct weighted average
"Mobile phone shipments jumped 26 percent to almost 112 million units , while Finnish company 's global market share rose to 39 percent from 36 percent .",positive,mobile phone shipment jumped percent almost million unit finnish company global market share rose percent percent,1,mobile jumped finnish global rose percent
"Selects Third Party Logistics Leader Transplace for Best-in-Class Technology , Procurement Capabilities ; Leading Specialty Packaging Manufacturer Employs Complete 3PL Solution for Supply Chain Visibility and Transportation Efficiency to Increase Service Levels and On-Time Deliveries",positive,selects third party logistics leader transplace bestinclass technology procurement capability leading specialty packaging manufacturer employ complete pl solution supply chain visibility transportation efficiency increase service level ontime delivery,1,third leading employ complete pl
4G allows customers to use mobile broadband services with speeds up to ten times higher than with today 's 3G .,positive,g allows customer use mobile broadband service speed ten time higher today g,1,allows mobile ten higher g
"Based on strong customer interest and feedback , using RPM mobile phone manufacturers , operators , enterprises and developer forums can significantly increase their product and service quality , user-experience and cost-efficiency '' , Tulonen continues .",positive,based strong customer interest feedback using rpm mobile phone manufacturer operator enterprise developer forum significantly increase product service quality userexperience costefficiency tulonen continues,1,based strong using mobile increase continues
`` Ixonos has a rich heritage in developing leadership experiences in the smartphone segment .,positive,ixonos rich heritage developing leadership experience smartphone segment,1,rich developing
`` The acquisition of Elektros Pavara completes KONE 's market expansion strategy in the Baltic Countries .,positive,acquisition elektros pavara completes kone market expansion strategy baltic country,1,pavara completes kone baltic
18 January 2010 - Finnish IT consultancy Trainers ' House Oyj HEL : TRH1V said last Friday it resolved to issue a EUR5m hybrid bond to domestic investors in a bid to strengthen its capital structure .,positive,january finnish consultancy trainer house oyj hel trh v said last friday resolved issue eur hybrid bond domestic investor bid strengthen capital structure,1,january finnish said last friday resolved hybrid domestic strengthen
"Repair and maintenance business accounted for net sales of EUR 645.3 mn , up from EUR 563.6 mn .",positive,repair maintenance business accounted net sale eur mn eur mn,1,accounted net
"The money will be spent `` on strengthening the company 's competitiveness in the sphere of sawmill products and increasing the volume of wood delivered for processing in Russia , '' the release says .",positive,money spent strengthening company competitiveness sphere sawmill product increasing volume wood delivered processing russia release say,1,spent strengthening sawmill increasing delivered say
The new technology improves the glass quality and consistency while increasing throughput .,positive,new technology improves glass quality consistency increasing throughput,1,new improves glass increasing
"The Vaisala Group is a successful international technology company that develops , manufactures and markets electronic measurement systems and products .",positive,vaisala group successful international technology company develops manufacture market electronic measurement system product,1,successful international develops electronic
We look forward to helping the company develop its operational services and further digitalize its services for its customers . '',positive,look forward helping company develop operational service digitalize service customer,1,look helping develop operational
"`` The number of collection errors fell considerably , and operations speeded up .",positive,number collection error fell considerably operation speeded,1,fell speeded
"By combining its existing solutions into a single platform , Comptel said that it has reduced the cost of deployment .",positive,combining existing solution single platform comptel said reduced cost deployment,1,combining existing single said reduced
"In the second quarter of 2010 , the group 's pretax loss narrowed to EUR 400,000 from EUR 600,000 .",positive,second quarter group pretax loss narrowed eur eur,1,second pretax narrowed eur
"26 January 2011 - Finnish metal products company Componenta Oyj ( HEL : CTH1V ) said yesterday its net loss narrowed to EUR500 ,000 in the last quarter of 2010 from EUR5 .3 m for the same period a year earlier .",positive,january finnish metal product company componenta oyj hel cth v said yesterday net loss narrowed eur last quarter eur period year earlier,1,january finnish said net narrowed last
