text,label,clean_text,target,adj_text
"Meanwhile , Electrowatt-Ekono Philippines , Inc. was also awarded a three-year operation and maintenance ( O&M ) contract by FR Cement Corporation .",positive,meanwhile electrowattekono philippine inc also awarded threeyear operation maintenance contract fr cement corporation,1,electrowattekono awarded threeyear fr
"Meanwhile , Nokia said that it will be able to deliver a complete range of services from deployment operations to consulting and integration to managed services as a result of the buyout .",positive,meanwhile nokia said able deliver complete range service deployment operation consulting integration managed service result buyout,1,said able complete consulting managed
"Nevertheless , Fitch notes that the business fundamentals of the three banks currently remain sound .",positive,nevertheless fitch note business fundamental three bank currently remain sound,1,fitch fundamental remain sound
"Nokia controls more than 50 percent of phone sales in India and Africa , and has a strong prosition on most other emerging markets .",positive,nokia control percent phone sale india africa strong prosition emerging market,1,strong emerging
NORDIC BUSINESS REPORT-26 June 2006-Metso Corporation wins EUR50m equipment order in Australia -_ 1998-2006 M2 COMMUNICATIONS LTD The Finnish engineering and technology group Metso Corporation said on Monday ( 26 June ) that it has received a EUR50m equipment order in Australia .,positive,nordic business report june metso corporation win eur equipment order australia communication ltd finnish engineering technology group metso corporation said monday june received eur equipment order australia,1,nordic metso australia finnish said monday received eur
"Of the sales price , a sales gain of some 3.1 mln euro ( $ 4.5 mln ) will be recognized in Incap 's earnings for 2007 .",positive,sale price sale gain mln euro mln recognized incap earnings,1,recognized incap
Outotec 's net profit for the second quarter of 2007 jumped to 16.8 mln euro ( $ 23.1 mln ) from 4.6 mln euro ( $ 6.3 mln ) a year ago .,positive,outotec net profit second quarter jumped mln euro mln mln euro mln year ago,1,outotec net second jumped mln
Panostaja Oyj s ( Panostaja ) Board of Directors decided on 16 December 2010 on a new long-term incentive and commitment plan for members of the management team .,positive,panostaja oyj panostaja board director decided december new longterm incentive commitment plan member management team,1,oyj panostaja decided new longterm
"Pioneer Library System was one of 127 libraries , municipalities , arts , culture and higher education and science organizations to have been awarded grants to participate in The Big Read , the largest federal reading program in U.S. history .",positive,pioneer library system one library municipality art culture higher education science organization awarded grant participate big read largest federal reading program u history,1,higher awarded big largest federal u
Pretax profit jumped to EUR 21.9 million from EUR 3.1 million .,positive,pretax profit jumped eur million eur million,1,pretax jumped eur
"Profitability ( EBIT % ) was 13.9 % , compared to 13.1 % in the previous-year period .",positive,profitability ebit compared previousyear period,1,compared previousyear
Raute Corporation has received orders worth over EUR 12 million from OOO Ilim Bratsk DOK in Russia .,positive,raute corporation received order worth eur million ooo ilim bratsk dok russia,1,received ilim
"Recovery has been evident in the liquid handling business , particularly in areas outside Europe and primarily in North America and Asia .",positive,recovery evident liquid handling business particularly area outside europe primarily north america asia,1,evident handling america
"Sales improved to SEK 1,553 mn , compared with SEK 1,408 mn .",positive,sale improved sek mn compared sek mn,1,improved sek compared sek
"Savon koulutuskuntayhtyma , Finland based company has awarded contract for specialist agricultural or forestry machinery .",positive,savon koulutuskuntayhtyma finland based company awarded contract specialist agricultural forestry machinery,1,based awarded specialist agricultural
SKF 6 April 2010 - Alandsbanken has given a `` buy '' recommendation on Swedish industrial company SKF AB ( STO : SKF B ) with a share price target of SEK150 .,positive,skf april alandsbanken given buy recommendation swedish industrial company skf ab sto skf b share price target sek,1,skf given buy swedish industrial skf ab
Sony Ericsson and Nokia dominated the list of best-selling handsets with five models each .,positive,sony ericsson nokia dominated list bestselling handset five model,1,dominated bestselling handset
"Speaking to just-drinks today , a spokesperson for Olvi said : `` We have performed very well in all four countries we operate in - namely , Finland , Estonia , Latvia and Lithuania . ''",positive,speaking justdrinks today spokesperson olvi said performed well four country operate namely finland estonia latvia lithuania,1,speaking spokesperson said performed operate
Sports equipment sales also progressed well owing to the prolonged winter season .,positive,sport equipment sale also progressed well owing prolonged winter season,1,progressed owing prolonged
Stockmann MasterCard has widened the scope of this cooperation to Estonia and Latvia .,positive,stockmann mastercard widened scope cooperation estonia latvia,1,widened scope
TELE2 Affarsvarlden gave a `` buy '' recommendation on mobile operator Tele2 AB and a share price target of 142 crowns ( $ 23.54 - 15.19 euro ) .,positive,tele affarsvarlden gave buy recommendation mobile operator tele ab share price target crown euro,1,tele gave buy
That topped consensus forecasts for earnings of 0.21 euros a share .,positive,topped consensus forecast earnings euro share,1,topped
The acquisition of Kaupthing Sverige will bring a significant positive non-recurring addition to the group 's performance .,positive,acquisition kaupthing sverige bring significant positive nonrecurring addition group performance,1,kaupthing sverige significant positive
The acquisition will have an immediate positive impact on Aspocomp 's financial result .,positive,acquisition immediate positive impact aspocomp financial result,1,immediate positive financial
The amending of the proposal simplifies the proposed plan and increases the incentive for key employees to stay in the Company .,positive,amending proposal simplifies proposed plan increase incentive key employee stay company,1,amending proposed increase incentive key
"The Australian company Mirabela Nickel has awarded Outokumpu Technology a contract for grinding technology for its nickel sulfide project in Bahia State , Brazil .",positive,australian company mirabela nickel awarded outokumpu technology contract grinding technology nickel sulfide project bahia state brazil,1,australian awarded grinding sulfide
"The broker has initiated both Palfinger AG and Konecranes OYJ with ` buy ' recommendations , with 51 and 42 eur price targets respectively .",positive,broker initiated palfinger ag konecranes oyj buy recommendation eur price target respectively,1,initiated oyj buy eur
"The buyer aims to thus reinforce its position in Denmark , Martela Group managing director Heikki Martela said .",positive,buyer aim thus reinforce position denmark martela group managing director heikki martela said,1,reinforce managing said
The companies have agreed on long-term cooperation to mechanise harvesting in Stora Enso 's eucalyptus plantations in Southern China .,positive,company agreed longterm cooperation mechanise harvesting stora enso eucalyptus plantation southern china,1,agreed longterm harvesting stora southern
The company aims to maintain this trend in profitability during the current year .,positive,company aim maintain trend profitability current year,1,maintain current
The company also said that in Poland a profitability program has been launched at the Oborniki steel frame and sandwich panel plant .,positive,company also said poland profitability program launched oborniki steel frame sandwich panel plant,1,said poland launched sandwich
"The company has established a 3G base station at about 17,000 feet at the foot of Mount Everest that will enable mountain climbers at the 29,035-foot summit to surf the Internet and even send videos of their exploits .",positive,company established g base station foot foot mount everest enable mountain climber foot summit surf internet even send video exploit,1,established g foot enable climber foot send
The company is also featured in the Ethibel Pioneer Investment Register and included in Innovest 's Global 100 list of the world 's most sustainable corporations .,positive,company also featured ethibel pioneer investment register included innovest global list world sustainable corporation,1,featured included innovest global sustainable
"The company 's goal is to achieve annual savings of EUR 2 million ( USD 2.7 m ) , of which two thirds are to be realized in 2010 .",positive,company goal achieve annual saving eur million usd two third realized,1,achieve annual saving eur usd third realized
The company said it observed a current stabilisation in prices and there is potential for higher prices for deliveries in the first quarter of 2011 .,positive,company said observed current stabilisation price potential higher price delivery first quarter,1,said observed current higher first
The company will also be compensated for acting as a reserve batch plant .,positive,company also compensated acting reserve batch plant,1,compensated acting
The Group also has a strong global position in other fishing categories .,positive,group also strong global position fishing category,1,strong global
The Group 's cash flow from operations will be positive .,positive,group cash flow operation positive,1,positive
The mill has long traditions and holds an established position in the markets .,positive,mill long tradition hold established position market,1,long established
"The move is aimed at boosting sales , cost-efficiency and market share in Finland .",positive,move aimed boosting sale costefficiency market share finland,1,aimed boosting
"The original name Componenta +_m+_l , as a subsidiary of the Finnish Componenta Group , has been changed to +_m+_l Components and the company has seen a 63 % growth in Q1 2010 , in comparison to Q1 2009 .",positive,original name componenta ml subsidiary finnish componenta group changed ml component company seen growth q comparison q,1,original componenta finnish changed ml seen
The parties have also agreed on options that allow UH to extensively implement later on also functionalities of human resources management .,positive,party also agreed option allow uh extensively implement later also functionality human resource management,1,agreed implement human
"The pilot project proved that RIFD technology is ideal for our purposes '' , comments Olli Saarinen , Material Handling Supervisor at Yara .",positive,pilot project proved rifd technology ideal purpose comment olli saarinen material handling supervisor yara,1,proved rifd purpose olli saarinen material
"The planned facility , estimated to cost around $ 814 million , would be the largest biodiesel plant in the world , and use palm oil certified by the Roundtable on Sustainable Palm Oil ( RSPO ) .",positive,planned facility estimated cost around million would largest biodiesel plant world use palm oil certified roundtable sustainable palm oil rspo,1,planned estimated would largest palm certified roundtable sustainable
This combined with foreign investments creates interesting opportunities for Solteq .,positive,combined foreign investment creates interesting opportunity solteq,1,combined foreign creates interesting
"This is Done Logistics ' largest order in Norway , the diversified group said .",positive,done logistics largest order norway diversified group said,1,done largest diversified said
This resulted in improved sales figures in Sweden .,positive,resulted improved sale figure sweden,1,resulted improved
"Under the agreement GeoSentric will provide GyPSii-powered hotel information and reservation services to visitors to China , including such popular cities as Beijing and Shanghai .",positive,agreement geosentric provide gypsiipowered hotel information reservation service visitor china including popular city beijing shanghai,1,geosentric gypsiipowered including popular
"Vaisala also said it expects net sales of EUR 253.2 million for 2010 , compared with EUR 252.2 million recorded in 2009 .",positive,vaisala also said expects net sale eur million compared eur million recorded,1,said expects net compared recorded
Validating our fgVoIP client through Symbian Signed represents a significant step forward in accomplishing this goal .,positive,validating fgvoip client symbian signed represents significant step forward accomplishing goal,1,validating fgvoip signed represents significant accomplishing
"Wartsila won the contract in October 2007 and the plant will be installed at Manturovo in the Kostroma region of Russia , about 600 km northeast of Moscow , Russia .",positive,wartsila contract october plant installed manturovo kostroma region russia km northeast moscow russia,1,installed manturovo kostroma km northeast
"We are honored to be recognized by Gartner as a specialist in Business Process Modeling and Analysis , in the company of many of the largest software vendors in the world .",positive,honored recognized gartner specialist business process modeling analysis company many largest software vendor world,1,honored recognized gartner modeling many largest
We are now in a position to pursue novel clinical candidates going forward . '',positive,position pursue novel clinical candidate going forward,1,novel clinical going
- UPM-Kymmene upgraded to ` in-line ' from ` underperform ' by Goldman Sachs .,positive,upmkymmene upgraded inline underperform goldman sachs,1,upgraded inline underperform
`` Consumers have very well received our packed fresh meat .,positive,consumer well received packed fresh meat,1,received packed fresh
`` Demand for sports equipment was good in 2005 .,positive,demand sport equipment good,1,good
"`` Last year , Finnair recorded a 32.6-percent growth on the Asian sector , carrying more than 1.10 million passengers between the two continents . ''",positive,last year finnair recorded percent growth asian sector carrying million passenger two continent,1,last recorded percent asian carrying
`` The additional flight linking Mumbai with Helsinki was dictated by the strong traffic demand between Asia and Europe .,positive,additional flight linking mumbai helsinki dictated strong traffic demand asia europe,1,additional linking dictated strong
`` The lowering of prices by us and by our competitors shows that the real estate market has stabilised and returned into balance and apartments are acquiring a fair price in the eyes of our clients .,positive,lowering price u competitor show real estate market stabilised returned balance apartment acquiring fair price eye client,1,lowering show real stabilised returned acquiring fair
"`` The new structure provides better communication , faster decision-making and cost savings , '' Proha said .",positive,new structure provides better communication faster decisionmaking cost saving proha said,1,new provides better decisionmaking saving said
"`` This contract demonstrates our ability to apply our minerals and metals technologies in adjacent industries , such as oil shale processing .",positive,contract demonstrates ability apply mineral metal technology adjacent industry oil shale processing,1,demonstrates mineral adjacent
`` We are pleased to deliver the Basware Invoice Automation solution to a major retail company in the US .,positive,pleased deliver basware invoice automation solution major retail company u,1,pleased major retail
"`` We have tailored our solutions to meet Solel 's technical requirements , and the result is both cost-effective manufacturing and highest-quality reflectors . ''",positive,tailored solution meet solel technical requirement result costeffective manufacturing highestquality reflector,1,tailored solel technical costeffective
`` We 've been feeling quite positive about the region as a whole .,positive,feeling quite positive region whole,1,feeling positive
21 December 2010 - Finnish industrial machinery company Wartsila Oyj Abp HEL : WRT1V said yesterday it had won an order to design a liquefied natural gas LNG powered platform supply vessel PSV for Norwegian oil service provider Eidesvik Offshore ASA OSL : EIOF .,positive,december finnish industrial machinery company wartsila oyj abp hel wrt v said yesterday order design liquefied natural gas lng powered platform supply vessel psv norwegian oil service provider eidesvik offshore asa osl eiof,1,december finnish industrial wartsila oyj said liquefied natural powered platform norwegian asa
Finlan 's listed food industry company HKScan Group controlled companies in the Baltics improved revenues by EUR 3.5 mn to EUR 160.4 mn in 2010 from EUR 156.9 mn in the year before .,positive,finlan listed food industry company hkscan group controlled company baltic improved revenue eur mn eur mn eur mn year,1,listed hkscan controlled improved
"Finnish airline Finnair has won a deal with the UK public sector to be the official airline for flights from London Heathrow to Osaka in Japan , as well as flights between Manchester in the UK and Helsinki in Finland .",positive,finnish airline finnair deal uk public sector official airline flight london heathrow osaka japan well flight manchester uk helsinki finland,1,finnish deal uk public official uk
Finnish Cargotec has been awarded a significant order for a total of 292 Hiab loader cranes by BAE Systems in the US .,positive,finnish cargotec awarded significant order total hiab loader crane bae system u,1,finnish awarded significant total u
Finnish Cargotec 's Kalmar has received a significant order from the US Department of Defense .,positive,finnish cargotec kalmar received significant order u department defense,1,finnish received significant u
Finnish Outotec has been awarded a contract to supply a new zinc roaster with gas cleaning and sulphuric acid plant for the OZK Kardzhali zinc smelter in Bulgaria .,positive,finnish outotec awarded contract supply new zinc roaster gas cleaning sulphuric acid plant ozk kardzhali zinc smelter bulgaria,1,finnish awarded supply new cleaning sulphuric
"Finnish P+¦yry has been awarded an engineering contract by CFR , the national railway company of Romania .",positive,finnish pyry awarded engineering contract cfr national railway company romania,1,finnish awarded cfr national
"According to a report by Neomarkka , Kuitu Finland 's customers are interested in buying the company 's products when it restarts production .",positive,according report neomarkka kuitu finland customer interested buying company product restarts production,1,according interested restarts
"As a result , the distribution companies will start to distribute , in addition to their current product offering , Shimano reels , rods and other Shimano fishing tackle products on an exclusive basis .",positive,result distribution company start distribute addition current product offering shimano reel rod shimano fishing tackle product exclusive basis,1,start distribute current fishing tackle exclusive
Cargotec Germany GmbH has been awarded a contract by Stadtverwaltung Mainz for chassis bodies under Open procedure .,positive,cargotec germany gmbh awarded contract stadtverwaltung mainz chassis body open procedure,1,cargotec awarded open
CEO Erkki J+Ærvinen is happy with the company 's performance in 2010 .,positive,ceo erkki jrvinen happy company performance,1,erkki happy
Deliveries have started and the network will be ready for a launch soon .,positive,delivery started network ready launch soon,1,started ready
"Earnings per share for the quarter were also higher year-on-year at 0.33 eur versus 0.27 , and above market expectations of 0.28 eur .",positive,earnings per share quarter also higher yearonyear eur versus market expectation eur,1,higher yearonyear eur
"EBITDA for the year 2009 improved to EUR484m , as compared with EUR472m in 2008 .",positive,ebitda year improved eur compared eur,1,ebitda improved compared
"Estonian telecoms company Elisa 's customer numbers cross 400,000 TALLINN , Oct 22 , BNS - The Estonian telecommunications company Elisa won approximately 50,000 new clients in the nine months of this year , bringing the number to 401,800 by the end of September , the company said .",positive,estonian telecom company elisa customer number cross tallinn oct bns estonian telecommunication company elisa approximately new client nine month year bringing number end september company said,1,estonian elisa estonian elisa new bringing said
"Exel Composites ' long-term growth prospects remain favourable , however .",positive,exel composite longterm growth prospect remain favourable however,1,exel composite longterm prospect remain favourable
fi is developing cooperation in keyword advertising with Microsoft .,positive,fi developing cooperation keyword advertising microsoft,1,fi developing
"Finnish construction group Lemminkainen Oyj HEL : LEM1S said today it has won a contract to provide technical services for the Nevsky Centre shopping mall to be opened in November in St Petersburg , Russia .",positive,finnish construction group lemminkainen oyj hel lem said today contract provide technical service nevsky centre shopping mall opened november st petersburg russia,1,finnish lemminkainen oyj said provide technical nevsky shopping opened november st
Finnish mobile operator DNA will function as a subcontractor to Maingate and will be responsible for telecommunications connections .,positive,finnish mobile operator dna function subcontractor maingate responsible telecommunication connection,1,finnish responsible
"Finnish software developer Basware Oyj said on November 30 , 2006 its U.S. subsidiary Basware , Inc. won an order to provide software for contract lifecycle management to an unnamed U.S. medical technology company .",positive,finnish software developer basware oyj said november u subsidiary basware inc order provide software contract lifecycle management unnamed u medical technology company,1,finnish said november u inc unnamed u medical
"However , sales volumes in the food industry are expected to remain at relatively good levels in Finland and in Scandinavia , Atria said .",positive,however sale volume food industry expected remain relatively good level finland scandinavia atrium said,1,expected good said
Incap and Lankapaja aim to enter into actual agreement to transfer the sheet-metal production to the buyer in February in order to complete the transfer on 1 March 2011 .,positive,incap lankapaja aim enter actual agreement transfer sheetmetal production buyer february order complete transfer march,1,enter actual sheetmetal february complete
Mr Kivimeister said John Deer former Timberjack stands to win in the situation : it controls around 60 % of Estonia 's forest machinery market .,positive,mr kivimeister said john deer former timberjack stand win situation control around estonia forest machinery market,1,said former win forest
Nokia and Elisa will work together to bring a superior mobile gaming experience for Elisa customers .,positive,nokia elisa work together bring superior mobile gaming experience elisa customer,1,nokia bring superior mobile gaming
Nordea sees a return to positive growth for the Baltic countries in 2011 .,positive,nordea see return positive growth baltic country,1,nordea see return positive baltic
Operating profit improved by 16.7 % to EUR 7.7 mn .,positive,operating profit improved eur mn,1,improved eur
Operating profit improved by 39.9 % to EUR 18.0 mn from EUR12 .8 mn .,positive,operating profit improved eur mn eur mn,1,improved eur
Operating profit improved by 44.0 % to ER 4.7 mn from EUR 3.3 mn in 2004 .,positive,operating profit improved er mn eur mn,1,improved er
Operating profit improved to EUR 20.3 mn from EUR 11.4 mn .,positive,operating profit improved eur mn eur mn,1,improved eur
Outokumpu 's chief executive Juha Rantanen expressed his confidence in China market .,positive,outokumpu chief executive juha rantanen expressed confidence china market,1,outokumpu chief expressed
"Previously , the company anticipated its operating profit to improve over the same period .",positive,previously company anticipated operating profit improve period,1,anticipated improve
Productional situation has now improved .,positive,productional situation improved,1,productional improved
Rautaruukki said construction group YIT has awarded it a 2.5 mln eur contract to supply the steel structures for a new bridge spanning the Kemijoki river in Northern Finland .,positive,rautaruukki said construction group yit awarded mln eur contract supply steel structure new bridge spanning kemijoki river northern finland,1,said awarded new spanning northern
"Sales came in at 241 mln eur , compared with 211.4 mln , and also beating consensus forecasts of 235 mln eur .",positive,sale came mln eur compared mln also beating consensus forecast mln eur,1,came mln compared beating
"Sales VAT inclusive expanded by 19 percent , to 351 million euros .",positive,sale vat inclusive expanded percent million euro,1,expanded
Strong growth has continued also in China .,positive,strong growth continued also china,1,strong continued
Synergy benefits will start to materialise in the second quarter .,positive,synergy benefit start materialise second quarter,1,synergy benefit start materialise second
